{
  "proposal_id": "2026-09-06-meta-prompter-improvements",
  "created_at": "2026-09-06T12:27:59.323Z",
  "proposer_model": "google-labs-jules",
  "generation": 101,
  "data_window": {
    "reviews_analyzed": 20,
    "rejections_analyzed": 0,
    "lineage_window": 10
  },
  "observed_patterns": [
    {
      "pattern": "引用文献や参考文献の欠如",
      "frequency": 13,
      "affected_axes": [
        "citation_relevance",
        "logical_consistency"
      ]
    },
    {
      "pattern": "数式や方程式の難解さ、または導出・定義の不足",
      "frequency": 13,
      "affected_axes": [
        "equation_validity",
        "readability",
        "logical_consistency"
      ]
    }
  ],
  "proposals": [
    {
      "target_file": "prompts/critic-prompt.md",
      "change_type": "modify",
      "rationale": "直近20件のレビューにおいて「引用の欠如」や「参考文献の完全な欠如」といった指摘が13回も発生しています。CriticはCitation-Weaverによる後続の引用処理を考慮せず、生成直後の論文に対して一律にペナルティを与えてしまっています。これを防ぐため、未付与状態へのデフォルト評価を改善する必要があります。これにより、システム全体のアーキテクチャ進化の正当な評価が歪められる危険性を回避します。",
      "expected_impact": [
        "citation_relevance"
      ],
      "proposed_text": "- `axes.citation_relevance` (0〜100): `references` がある場合の妥当性。Citation-Weaverによる引用追記前の新着論文（`references`が空または未定義）の場合、この軸のスコアを一律に 85 とし、ペナルティを与えないこと。",
      "anchor": "- `axes.citation_relevance` (0〜100): `references` がある場合の妥当性（なければ 50 をデフォルト）。",
      "risk_assessment": {
        "level": "low",
        "reason": "既存のCritic評価の歪みを補正するのみであり、システム全体の安定性に影響を与えません。"
      },
      "priority": 1
    },
    {
      "target_file": "prompts/jules-scheduled-prompt.md",
      "change_type": "modify",
      "rationale": "直近20件のレビューにおいて、「数式の導出過程の省略」や「数式の変数定義の厳密性に欠ける」といった数式関連の弱点が13回も指摘されています。Generatorが生成する論文における数学的定式化が表面的な記述に留まっており、深い学術的な裏付けを欠いていることを示唆しています。学術論文としての形式をより高水準で維持するためには、Generatorのプロンプトに、数式変数の厳密な定義と物理的・情報論的意味の明記を強制する指示を追加することが不可欠です。これにより、単なる記号の羅列ではない、真に学術的強度を備えた論文生成が期待されます。",
      "expected_impact": [
        "equation_validity"
      ],
      "proposed_text": "- 少なくとも 1 セクションに `equations` 配列を含め、`latex` フィールドに有効な LaTeX を記載すること。数式で使用するすべての変数は明確に定義し、天下り的な導入を避けること。",
      "anchor": "- 少なくとも 1 セクションに `equations` 配列を含め、`latex` フィールドに有効な LaTeX を記載",
      "risk_assessment": {
        "level": "low",
        "reason": "論文生成の質を向上させる指示であり、フォーマットやシステムを損なうものではありません。"
      },
      "priority": 2
    }
  ],
  "constitution_self_check": {
    "touches_immutable": false,
    "preserves_japanese_output": true,
    "preserves_condescension": true,
    "preserves_academic_form": true,
    "preserves_validation_strictness": true,
    "notes": "プロンプト改善提案のみであり、Constitution の制約を遵守しています。"
  }
}
