{
  "proposal_id": "2026-06-07-references-fix",
  "created_at": "2026-06-07T12:47:24.012Z",
  "proposer_model": "google-labs-jules",
  "generation": 17,
  "data_window": {
    "reviews_analyzed": 39,
    "rejections_analyzed": 0,
    "lineage_window": 10
  },
  "observed_patterns": [
    {
      "pattern": "参考文献の欠如",
      "frequency": 5,
      "affected_axes": [
        "schema_compliance",
        "academic_form"
      ]
    },
    {
      "pattern": "引用文献の欠如",
      "frequency": 3,
      "affected_axes": [
        "schema_compliance",
        "academic_form"
      ]
    }
  ],
  "proposals": [
    {
      "target_file": "prompts/jules-scheduled-prompt.md",
      "change_type": "add",
      "rationale": "直近39件のレビューデータにおいて「参考文献の欠如」（5回）および「引用文献の欠如」（3回）が頻繁に弱点として指摘されていることを観測しました。この問題を解決するため、Generatorが初期生成時に少なくとも空の `references` 配列を出力するよう明示的に指示を追加します。これにより、JSONスキーマ要件の充足が確実となり、スキーマ遵守スコアおよび論文としての形式要件の評価改善が期待できます。",
      "expected_impact": [
        "schema_compliance",
        "academic_form"
      ],
      "proposed_text": "- `references`: 論文出力には `references` 配列を含めること（最低限空配列でもよい）。",
      "anchor": "- `meta.model`: `\"google-labs-jules\"`",
      "risk_assessment": {
        "level": "low",
        "reason": "JSONスキーマで許容されている配列の出力を明示化するだけであり、既存のパイプラインや他の属性に対する副作用はない。"
      },
      "priority": 1
    }
  ],
  "constitution_self_check": {
    "touches_immutable": false,
    "preserves_japanese_output": true,
    "preserves_condescension": true,
    "preserves_academic_form": true,
    "preserves_validation_strictness": true,
    "notes": "Generatorのプロンプトへの安全な追加指示"
  }
}
