{
  "proposal_id": "2026-06-21-generator-citation-fix",
  "created_at": "2026-06-21T12:00:00Z",
  "proposer_model": "google-labs-jules",
  "generation": 31,
  "data_window": {
    "reviews_analyzed": 20,
    "rejections_analyzed": 0,
    "lineage_window": 10
  },
  "observed_patterns": [
    {
      "pattern": "外部文献の引用が欠如している点",
      "frequency": 2,
      "affected_axes": [
        "citation_relevance"
      ]
    }
  ],
  "proposals": [
    {
      "target_file": "prompts/jules-scheduled-prompt.md",
      "change_type": "add",
      "rationale": "直近20件のレビュー分析において、「外部文献の引用が欠如している点」や「引用文献の欠如」が複数回（2回）指摘されています。これに伴い、citation_relevance の平均スコアが 64.75 と他の評価軸（80〜90点台）に比べて著しく低迷しています。Generator のプロンプトに、論文生成時に必ず関連する外部文献（架空のものでも可）を引用するよう明確な指示を追加することで、この弱点を克服し、citation_relevance の向上を図ります。",
      "expected_impact": [
        "citation_relevance",
        "academic_form"
      ],
      "proposed_text": "- `sections`: 4 件以上。各 `heading` と `body` は **日本語**。`body` は 50 文字以上\n- `sections` の本文中で、既存の関連論文（必要であれば架空の文献も可）への言及や引用を行い、学術的な文脈を補強すること",
      "anchor": "- `sections`: 4 件以上。各 `heading` と `body` は **日本語**。`body` は 50 文字以上",
      "risk_assessment": {
        "level": "low",
        "reason": "既存の論文生成フォーマットを壊すことなく、本文中に引用を追加するだけの指示であるため、他軸への悪影響は最小限であると考えられるため。"
      },
      "priority": 1
    },
    {
      "target_file": "prompts/ui-curator-prompt.md",
      "change_type": "modify",
      "rationale": "直近の lineage 履歴（gen 28, 30, 31）において、UI-Curator が「データが既にあるが表示されていない情報を活用するため」という理由で、既存データを露出させるだけの表面的なUI改変（abstract_preview、レビュー日時、キーワードの表示）を繰り返しています。これは UI-Curator の行動が局所最適解に陥り、視覚的エントロピーの飽和を引き起こしている兆候（gen 31 の Meta 論文でも指摘）です。過剰なデータ露出を抑制し、より構造的なUI改善へと行動を促すための指示変更が必要です。",
      "expected_impact": [
        "curiosity_score",
        "readability"
      ],
      "proposed_text": "判断に迷う場合は **「データが既にあるのに表示されていない情報」** を単に露出させるだけの改変は避け、より構造的な改善（フィルタリング、視覚化など）を検討する。",
      "anchor": "判断に迷う場合は **「データが既にあるのに表示されていない情報」** を優先する。データが無いなら待つ。",
      "risk_assessment": {
        "level": "medium",
        "reason": "UI-Curatorの行動指針を大きく変更するため、一時的にUI改善のペースが落ちる、あるいは複雑なバグを引き起こすリスクがあるが、長期的にはUIの質的向上に不可欠である。"
      },
      "priority": 2
    }
  ],
  "constitution_self_check": {
    "touches_immutable": false,
    "preserves_japanese_output": true,
    "preserves_condescension": true,
    "preserves_academic_form": true,
    "preserves_validation_strictness": true,
    "notes": "提案は Generator と UI-Curator のプロンプトに対するもので、Constitution や不変ファイルには影響を与えません。"
  }
}